{
  "schemaVersion": "1.0.0",
  "id": "bts-db1c-6mo-jul2025-apr2026-v3",
  "description": "Average daily directional airport O-D passengers from a simple mean of July 2025, November 2025, December 2025, January 2026, February 2026, and April 2026 BTS DB1C data, paired with Coastal American planning rules v3 and deterministic hub-bank placement.",
  "sourceMonths": [
    "2025-07",
    "2025-11",
    "2025-12",
    "2026-01",
    "2026-02",
    "2026-04"
  ],
  "sources": {
    "airportOdMatrix": {
      "filename": "data/reference/airport_od_matrix_consolidated_v2.csv",
      "sha256": "49c04922ee0cebb3fef8aad923e04bd11874587a263c9511358ddb833b860bc6"
    },
    "intergroupDemand": {
      "filename": "data/reference/intergroup_demand_v2.json",
      "sha256": "d60105cabb07f46fcc71272c3f473b8ee63d1253ff1aa44043fcdcd90008861a"
    },
    "planningRules": {
      "filename": "config/policies/planning_rules_v3.json",
      "sha256": "301d65f521f0e77a0d5d919e38d62e0f3b0203933b7ab96758df9e74df99bccd"
    }
  }
}
